店铺名称,页面id,类别,品牌名称,品牌id,品牌logo,评分,平均价格,最低价格,所属地区,地区Id,纬度,经度,详细地址,楼层,地铁站id,停车信息,优惠套餐情况,营业时间,联系电话,累计售出份数,餐厅简介,特色菜,是否小吃,有无外卖,上周订单数,历史订单数,wifi,支持预定
凡塔斯牛排餐厅(连江店),6692904,西餐,凡塔斯牛排,237945,http://p1.meituan.net/poi/7d673b3690f39ec5e430e0dc552f73b4155909.png,3.7,63,82,连江县中心城区,2956,26.21108,119.542849,连江县凤城镇敖江路龙芝商业广场一楼（新华都购物广场入口处、惠好百姓药店附近）,1,,免费停车,单人餐82元起，双人餐158元;,周一至周日 10:30-21:30,0591-26130186,23191,“凡塔斯”LAS VENTAS，一个充满传奇色彩，代表勇敢和荣耀，充溢着地中海浪漫风情的 响亮名称。其富含多重意蕴、积淀丰富的精神涵义，都赋予了“凡塔斯”牛排深刻而广阔的文化内涵。作为“凡塔斯”主营的特色产品，牛排的烹饪技艺不仅得益于西班牙厨艺名师的真谛传导——将西欧的饮食文化融入产品理念中，从食物出发，以美味动人。为品味卓越的都市人群缔造富有西班牙特色的美味情缘。凡塔斯与牛排的渊源始于2006年1月，彼时**家门店开张。经营之初，秉持“与客人分享、从不计较”的理念，数年来获得众多新老顾客的好评，好口味、好口碑迅速传开，客 人从此络绎不绝。为更多的美食爱好者带去全新的体验和卓越的享受。“美味的食物，用心的服务，超值的享受”是凡塔斯经营的不二法门。随着品牌名气的不断提高，市场影响力不 断扩大，凡塔斯在市场的占有率也跟着相应地增长。在福建区域形成自己的品牌规模，拥有一批忠实的消费群。 未来，我们将致力于成为中国优秀的餐饮企业连锁品牌，将凡塔斯开向全国，让更多的人分享由凡塔斯牛排带来的幸福体验！,,False,0,9,23191,True,False
1718海鲜火锅(五四路华福店),52173927,海鲜火锅,,0,,5,104,198,温泉公园/福州广场,95,26.098653,119.306566,鼓楼区五四路173号新华福广场b座2楼,,"4284,4278,4280,",,5-6人餐198元，2-3人餐269元，4人餐459元，5-6人餐699元，10人餐999元起;,周一至周日 11:30-13:30 17:30-02:30,0591-83281718,23015,,,False,1,120,23015,True,False
壹顿牛排(万象城店),115618021,牛排,,0,,4.6,29,32.9,万象城,97,26.064798,119.290255,台江区西环中路691号万象城B1层,-1,"5302,5311,",,单人餐32.9元起;,周一至周日 10:30-21:30,18030210916,22985,,,False,1,81,22985,False,False
凯宾斯基酒店·凯仕餐厅,41342757,海鲜自助,,0,,5,204,158,东二环泰禾广场,96,26.092663,119.332196,晋安区横屿路1号福州泰禾凯宾斯基酒店1F（东二环泰禾广场营销中心旁）,1,,,单人午餐158元，单人午餐188元，单人晚餐258元，单人晚餐288元;,"周六,周日 06:30-10:30 11:30-14:00 17:30-21:00  周一至周五 06:30-10:00 11:30-14:00 17:30-21:00",0591-86306206/88999988,22977,,,False,0,105,22977,True,False
探鱼(苏宁广场店),42665358,烤鱼,探鱼,1723817,http://p0.meituan.net/poi/bfcdf2bcdccdfc3a524af91bc3d69b7a57975.png,4.1,83,89,苏宁广场,97,26.062109,119.286365,台江区工业路233号苏宁广场5层,5,"5311,5302,",,每满100减8（买单立享）;89代100元;,周一至周日 11:00-22:00  非营业时段 2018-02-15至2018-02-15 04:00-24:00,0591-38119777,22785,,,False,1,159,22785,True,False
华丰贺氏(北大店),1153398,蛋糕,华丰贺氏,26183,,4.1,15,9.9,左海/西湖公园,95,26.092224,119.294675,鼓楼区北大路169号御西湖13-14号店（西湖福三中对面）,,"4280,4286,",有停车位,9.9元黑森林切件，“莓”好时光108元，8英寸蛋糕138元起，果仁果粒142元，小汽车148元，经典黑森林150元，芒果很黄174元;17代20元;,周一至周日 06:30-23:00,0591-83817355,22679,华丰贺氏始终坚持以传承与弘扬中华民族文化为己任，努力振兴民族品牌。以产品质量为企业生命，引进三套先进的月饼生产成套设备，从投料到成品全面实现全自动化生产流水线。一流的生产设备，再加上一流的生产经营管理，使得华丰贺氏跃上一个新台阶，华丰贺氏月饼已成为目前众多星级酒店代加工月饼优选厂家，华丰贺氏月饼已成为真正的五星级月饼。 华丰贺氏于2008年 7月正式全面导入全新的企业形象识别系统，华丰贺氏首家新形象旗舰店也同时开张，以一个全新的经营理念和创新的经营方式，优雅整洁赏心悦目的经营环境，打造出高格调的面包坊。华丰贺氏是目前福建省的面包专卖店，它的出现足以振撼烘焙界，它必将给福建烘焙行业带来一场新的革命，为全面提升福州烘焙水平做出新的贡献。,,False,1,59,22679,True,False
小龙坎老火锅(三坊七巷店),160817897,四川火锅,小龙坎,2883441,http://p0.meituan.net/poi/108c210fe9a4ae636e2711fa68841da394319.png,3.1,97,25,东街口/三坊七巷,95,26.080525,119.29843,鼓楼区吉庇巷72-2号（缘之园停车场）,,"4282,4286,5301,5307,",,2-3人餐186元，8人餐549元;25代50元，89代100元;,周一至周日 09:30-00:00,0591-87829355,22709,,,False,1,334,22709,False,False
锅小小锅旋转自助火锅(中防万宝城店),161874707,火锅自助,,0,,4.2,63,56,宝龙城市广场,97,26.061887,119.290925,台江区工业路199号中防万宝城负一楼肯德基与汉堡王中间,-1,"5302,5311,",,单人午餐56元，单人午/晚餐66元，双人午/晚餐132元，[4]人晚餐264元;94代100元;,周一至周日 11:00-14:00 17:00-21:30  2019-02-01至2019-02-09 休息,18649610315,22645,,,False,0,303,22645,False,False
东方红·老坛剁椒鱼头(万达店),1877867,湘菜,,0,,3.8,57,218,仓山万达广场,98,26.035576,119.273689,仓山区浦上大道276号仓山万达广场一区,3,,,4人餐218元;,周一至周日 10:00-22:00,0591-83818157,22567,,,False,1,6,22567,True,False
蜀大侠火锅(五一中路店),152399847,四川火锅,,0,,3.8,83,78,大利嘉/汽车南站,97,26.07246,119.312408,台江区五一中路71-3号,,"5310,4277,",,每满100减8（买单立享）;双人餐188元，4人餐298元，6人餐428元;78代100元;,周一至周日 11:00-03:00,0591-83288588,22415,,,False,0,93,22415,False,False
台湾森山仙草(西门永辉店),157110849,奶茶/果汁,,0,,5,17,8.5,左海/西湖公园,95,26.086718,119.287939,鼓楼区西洪路西门永辉对面（湖头街8号）,,,,14.9元招牌仙草，16.9元综合仙草冻3选1;8.5代10元;,周一至周日 10:00-23:00,18759188738,22294,,,False,1,83,22294,True,False
华莱士(文山店),40914660,汉堡,华莱士,26189,http://p0.meituan.net/poi/40b78b9357bc226b82ad406d2d4ae43429705.png,3.9,18,3.8,连江县中心城区,2956,26.211807,119.537818,连江县凤城镇文山北路太一新天地6号楼一层5号店,,,,3.8元特价黑椒鸡块，7.8元小吃组，9.9元单人餐A，10元小食套餐，13.9元单人餐B，19.9元双人餐A，28.9元双人餐B;,周一至周日 09:00-00:00,0591-26161627,22037,,,False,1,84,22037,True,False
一本屋寿司(五一路店),3262180,日式寿司,,0,,4.2,56,26,大利嘉/汽车南站,97,26.061657,119.313167,台江区五一南路28号（打铁垱车站附近）,,"4279,",,1-2人餐26元，单人餐28元，1-2人餐39元，3-4人餐92元，3-4人餐99元，3-4人餐168元;45代50元;,周一至周日 10:00-21:00,0591-83202235/18705005330,22028,一本屋和风精致料理，总公司位于上海西郊国际水产馆，在台湾60年知名水产北都食品有限公司和香港皇臣餐饮公司共同组建。台湾北都水产有限公司和上海西郊水产馆为一本屋提供新鲜的食材和**手的原物料，**时间送达到店内，满足客人娇宠的味蕾。公司从事进出口海产品贸易数十年，海产品远销日本，美国以及其它海外国家。海外客人和国内客人的认可，成就了公司蓬勃发展，也是对公司原材料品质的认可。我们有专业的养殖团队，在福建以及国内的其它地方都设有养殖基地，确保食材的掌控和监控。同时，我们也有渔船配备，确保采购和捕捞。香港皇臣餐饮公司，是专业的餐饮服务团队，精致的服务和客人至上的服务宗旨，一直是公司所推崇并发扬的企业文化。当然，一本屋的用餐环境也是我们引以为傲的一点，我们追求低调华丽的用餐氛围，小桥流水的设计，榻榻米包厢的惬意，以及处处弥漫的和风气息，让你更能感受到，你绝不仅仅在享受一份用餐，更是心灵的放松。我们的心意很简单，就是用新鲜的食材来娇宠你的胃，让你体内幸福的暖流瞬间开始涌动。,,False,1,0,22028,True,False
华莱士(宝龙城市广场店),835917,汉堡,华莱士,26189,http://p0.meituan.net/poi/40b78b9357bc226b82ad406d2d4ae43429705.png,3.9,18,5.8,宝龙城市广场,97,26.061477,119.292904,台江区工业路193号宝龙城市广场1层,1,"5302,5311,",,5.8元1人餐，8元单人餐，9.9元1人餐，15.8元烤腿堡单人餐，35.9元双人餐，36.3元双人餐;21代30元，25代30元;,周一至周日 09:00-24:00,0591-83800716,21778,烤翅、蜜汁烤鸡、板烧汉堡蛮好吃的，价格也“比KFC和麦当劳便宜”。而且“分店很多”，“一般都能找到在公司附近的”。叫份外卖当工作餐，“换换口味不错”。,,False,1,66,21778,False,False
阿弥陀佛珍素馆(三坊七巷店),113395284,素食,,0,,4.9,155,97,东街口/三坊七巷,95,26.082335,119.293471,鼓楼区三坊七巷通湖路251号正祥望园（消防博物馆与通湖公寓交汇处正对面）,,"4286,4282,",,单人午餐97元，单人晚餐111元，[4]人晚餐444元，[6]人晚餐666元，[10]人午餐966元，[10]人晚餐1106元;97代138元，111代158元;,周一至周日 11:30-14:00 17:30-21:00,0591-28329678/28359678,21714,,,False,0,131,21714,False,False
石山水美式餐厅(台江万达店),87299,牛排,石山水,844490,http://p1.meituan.net/poi/d3563263f9d6110ecbdeca724351815079490.png,3.7,84,98,台江万达,97,26.051703,119.342268,台江区鳌峰路31号江滨中大道北侧曙光路东侧金融街万达广场3层3-30室,3,,,单人餐98元，双人餐188元起;,周一至周日 11:00-22:30,0591-88359659,21619,石山水美式餐厅是隶属于双福集团旗下的一个全球连锁餐饮品牌，源自于1909年美国加利福尼亚州落杉矶西部小镇的一个阳光乡村牛排馆。他们以连锁经营为拓展模式，从自1998年福州五一广场双福楼门店开业以来，在新老客户的支持下，石山水美式餐厅已在福州繁华的各大商圈拥有六家直营连锁店，同时在宁德、泉州晋江和江苏盐城等相继开出连锁加盟店。秉着铸造美式西餐行业品牌的宏伟目标，石山水坚持将美式西餐的概念融入东方餐饮文化，在东西方的融合中，形成了崭新的适合中国人的西餐，开辟出一片新的天地。,,False,0,16,21619,True,False
辣皇朝(福新中路店),5797242,小龙虾,辣皇朝,1251027,http://p1.meituan.net/poi/27d84ebd0ddbc96ea8dda012fc849b4988577.png,3.8,99,229,五一广场/古田路,95,26.080902,119.322926,鼓楼区福新中路75-12号永同昌大厦1楼（福建彩印厂店面）,,"5305,",,2-3人餐229元，2-3人餐299元，4-6人餐399元;,周一至周日 16:30-02:00,0591-63360777,21536,辣皇朝火锅源自创始人之家传秘方，以辣皇朝实体店数十年经营为基石，坚持“以健康为本，以上品待客”，汲取、结合传统工法与现代设备之所长，经过工坊技术团队“‘醇香，川味”的融合与发扬，秉承“川人川味，蜀地蜀风”的文化取向和经营风格，塑造了厚重的品牌。,,False,1,3,21536,True,False
华莱士(状元店),5144398,汉堡,华莱士,26189,http://p0.meituan.net/poi/40b78b9357bc226b82ad406d2d4ae43429705.png,4.6,18,3.8,建新镇,98,26.07388,119.24956,仓山区洪塘路与闽江大道交叉口西北角（永辉超市对面）,,,,3.8元特价黑椒鸡块，7.8元小吃组，9.9元单人餐A，10元小食套餐，13.9元单人餐B，19.9元双人餐A，28.9元双人餐B;,周一至周日 09:30-23:30  2019-01-27至2019-02-08 休息,0591-87976517,21485,,,False,0,0,21485,True,False
四道菜(福清万达店),6341659,福建菜,四道菜,357814,http://p1.meituan.net/poi/59f6ebeaa3c4c86c97850c70f458062e67550.png,3.5,50,95,万达广场,1186,25.715482,119.350054,福清市清昌大道105号万达广场3F,3,,,95代100元;,周一至周日 11:00-15:00 17:00-22:00,0591-86958881,21394,,,False,0,38,21394,True,False
玛格利塔(吴航店),4912131,披萨,玛格丽塔,1351163,http://p0.meituan.net/poi/0e925ec4a5330a532b2417bfb265b92036387.png,4.6,20,9.9,长乐市中心城区,2954,25.960009,119.504053,长乐市航城街道锦江花园三区超市一层,,,,单人餐9.9元，双人餐56.8元;17.5代20元;,周一至周日 10:00-22:00,0591-28791779,21330,玛格利塔披萨自成立以来，以“浓情意味，现烤披萨”的理念让玛格利塔在市场的机遇不断提高。人们的生活水平在不断提高，比萨这种西式餐品正在被越来越多的国人所接受随之而来的比萨文化正充满生活的每个时刻。比萨不再仅仅是一种食品，它逐渐与时尚、品位紧紧联系在一起，体现出高尚品质的现代生活，或是交友谈心，或是商务会谈，或是休闲怡情尽在一块香浓美味的比萨中。,,False,1,4,21330,True,False
元申太日式铁板烧自助(中防万宝城店),161875453,日式铁板烧,,0,,4.5,139,129,万象城,97,26.062227,119.289636,台江区工业路193号中防万宝城美食城025号,-1,"5302,5311,",,单人午餐129元，单人晚餐139元，双人午餐256元，双人晚餐276元;,周一至周日 11:30-13:30 17:00-22:00  2019-02-04至2019-02-07 休息,0591-83826025,21135,,,False,0,249,21135,False,False
花姐过桥米线(万象城店),2364428,云南菜,,0,,4.6,21,0,万象城,97,26.064435,119.290625,台江区工业路378号万象城4层,4,"5302,5311,",,,周一至周日 10:30-21:00,,21074,米线是云南的特色食品。云南正宗过桥米线是将米线、汤料、配料分别制作，现吃现拌的烹调形式和食用方法。是米线中的上品，以用料考究，制作精良，吃法独特，独具风味而闻名中外,,False,1,0,21074,False,False
蚝门火锅(大利嘉城店),69921264,火锅,,0,,3.6,97,45,大利嘉/汽车南站,97,26.068424,119.312862,台江区五一中路151号华能大厦2楼（大利嘉城旁，同仁堂2楼）,,"4277,5310,",免费提供50个停车位,每满100减8（买单立享）;90代100元;,周一至周日 11:00-04:30,0591-87809898,21073,,,False,0,3,21073,True,False
小鱼小牛(爱琴海东百店),160458488,干锅/香锅,,0,,5,83,93,红星爱琴海广场,98,26.041321,119.279508,仓山区浦上大道198号爱琴海6楼东百08店面,6,,,每满100减5（买单立享）;双人餐129元，3人餐198元，4人餐268元;93代100元;,周一至周日 10:30-21:00,0591-83501775/83508750,21064,,,False,1,103,21064,False,False
华莱士(仙塔店),842936,汉堡,华莱士,26189,http://p0.meituan.net/poi/40b78b9357bc226b82ad406d2d4ae43429705.png,4.6,18,3.8,省立/旗汛口,95,26.085369,119.305359,鼓楼区仙塔新村4号楼31号店面（近三山大厦）,,"4286,4282,",,3.8元特价黑椒鸡块，7.8元小吃组，9.9元单人餐A，10元小食套餐，13.9元单人餐B，19.9元双人餐A，28.9元双人餐B;,周一至周日 08:30-24:00,0591-88388172,21009,烤翅、蜜汁烤鸡、板烧汉堡蛮好吃的，价格也“比KFC和麦当劳便宜”。而且“分店很多”，“一般都能找到在公司附近的”。叫份外卖当工作餐，“换换口味不错”。,,False,1,38,21009,True,False
西树泡芙(五四北泰禾广场店),5257731,蛋糕,,0,,4.2,12,9,五四北,96,26.13932,119.3255,晋安区坂中路6号3期6号楼第五层L516商铺,6,"4285,4283,",,每满10减1（买单立享）;39.8元摩提经典套餐;9代10元;,周一至周日 10:00-22:00,13850901504,20960,摩提，薄薄的冰皮糯米包裹着各种风味的馅料，吃起来冰冰的。随着不断地深入，口感层次也愈加丰富、同时伴随着淡淡的奶油，味道更具独特，欢迎大家来品尝。,,False,1,1,20960,True,False
聚春园大酒店(东街口总店),829843,综合自助,聚春园大酒店中餐厅,936031,,3.6,181,88,乌山/冠亚广场,95,26.086521,119.299619,鼓楼区东街2号，海峡影城对面（肯德基，新华都旁）,,"4286,4282,",商家服务：免费提供20个停车位,单人午餐88元，单人晚餐98元，单人午餐98元，单人晚餐108元，10人餐1280元起;,周一至周日 11:30-13:30 17:30-20:30,0591-87533604,20829,老字号闽菜馆，“在福州人心目中地位挺高”。佛跳墙是“镇店之宝”，“集多种山珍海味于一坛”，“汤浓味正”，上等品“需提前预订”。其他闽菜也都“不失水准”，卖相“精致”，口味“稳重”，“确有大家风范”。价格“真是贵”（加收服务费），“不是平头老百姓所能想象的”。适合商务宴请。,,False,0,230,20829,True,False
1718海鲜火锅(融侨一店),1124793,海鲜火锅,1718公馆,32951,,4.7,105,269,福州大学/西禅寺,95,26.067967,119.270076,鼓楼区西江滨大道66号融侨锦江B区35号店,,,,2-3人餐269元，4人餐459元，5-6人餐699元，10人餐999元起;,周一至周日 11:00-21:00,0591-83771718,20744,1718公馆致力于打造时尚、绿色、食惠的饮食文化，在饮食打造上，1718公馆结合《本草纲目》中阐述的多种食疗效用，推出各式养身火锅，佐以精心挑选的上品海鲜、天然河鲜、精品牛肉、手工丸滑、农家地道野味，打造出清新典雅的中式消费格调，能满足商务人士讲究乃至挑剔的口味，“1718”寓意“要吃要发”。作为一家在夏天开业的火锅餐厅，以其“不合时宜”而引起周围食客的广泛关注，而开业后生意的火爆也是令很多人不解的：夏天的火锅为何这么“火”？究其原因，除了广大消费者在相关论坛评论的“冷气充足”之外，大抵还有以下两个原因：1、环境清幽：1718公馆外遍植绿化树，乃至有荷叶；而室内则颇有茶艺居之雅静；2、火锅特色做：并非传统概念上的“鸳鸯锅”，而是结合了福州当地的消费饮食习惯，加入海鲜、山珍等多种元素,,False,1,5,20744,True,False
华莱士(百合店),1876860,汉堡,华莱士,26189,http://p0.meituan.net/poi/40b78b9357bc226b82ad406d2d4ae43429705.png,4.8,18,3.8,榕城广场/金山公交站,98,26.052727,119.265662,仓山区金山大道金山百合苑1号楼21号店面,,"5295,5303,",,3.8元特价黑椒鸡块，7.8元小吃组，9.9元单人餐A，10元小食套餐，13.9元单人餐B，19.9元双人餐A，28.9元双人餐B;,周一至周日 09:00-22:00,0591-88202500,20654,烤翅、蜜汁烤鸡、板烧汉堡蛮好吃的，价格也“比KFC和麦当劳便宜”。而且“分店很多”，“一般都能找到在公司附近的”。叫份外卖当工作餐，“换换口味不错”。,,False,1,17,20654,True,False
大渝火锅(台江万达店),163170087,重庆火锅,大渝火锅,2555833,http://p1.meituan.net/poi/b483f987ee42f4a49e025863a2df709e42219.png,5,111,23,台江万达,97,26.051578,119.34316,台江区鳌江路8号金融街万达广场3F,3,,,单人餐23元起;90代100元;,周一至周日 10:00-22:00,0591-83301217,20633,,,False,0,124,20633,False,False
华莱士(湖前店),1877258,汉堡,华莱士,26189,http://p0.meituan.net/poi/40b78b9357bc226b82ad406d2d4ae43429705.png,4.4,19,3.8,省体/湖前,95,26.112934,119.297071,鼓楼区福飞南路258号福泉花园8号店面,,,,3.8元特价黑椒鸡块，7.8元小吃组，9.9元单人餐A，10元小食套餐，13.9元单人餐B，19.9元双人餐A，28.9元双人餐B;,周一至周日 09:00-01:00,0591-87765780,20492,烤翅、蜜汁烤鸡、板烧汉堡蛮好吃的，价格也“比KFC和麦当劳便宜”。而且“分店很多”，“一般都能找到在公司附近的”。叫份外卖当工作餐，“换换口味不错”。,,False,1,48,20492,True,False
九龍唐港式料理,157762263,茶餐厅,,0,,4.1,80,118,东街口,95,26.08685,119.31482,鼓楼区东水路18号金仕顿大酒店一楼（东大路东水路口旁）,,,,双人餐118元，3-4人餐218元，3-4人餐228元，6人餐288元，5人餐298元，8人餐499元;,周一至周日 10:30-14:30 17:00-21:30,0591-88865555,20372,,,False,1,10,20372,True,False
华莱士(福湾檀府店),41719404,汉堡,华莱士,26189,http://p0.meituan.net/poi/40b78b9357bc226b82ad406d2d4ae43429705.png,4.2,19,3.8,福湾新城/湾边,98,26.01043,119.27741,仓山区建新镇福湾路透浦一路口春风苑一区7号楼2号店面,,,,3.8元特价黑椒鸡块，7.8元小吃组，9.9元单人餐A，10元小食套餐，13.9元单人餐B，19.9元双人餐A，28.9元双人餐B;,周一至周日 08:00-22:00,0591-83848973,20103,烤翅、蜜汁烤鸡、板烧汉堡蛮好吃的，价格也“比KFC和麦当劳便宜”。而且“分店很多”，“一般都能找到在公司附近的”。叫份外卖当工作餐，“换换口味不错”。,,False,1,41,20103,True,False
新华都海物会(五四店),150560913,海鲜,,0,,5,154,118,五四路,95,26.09631,119.30618,鼓楼区五四路162号华城国际五楼（电梯出口处）,5,"4284,4280,",,双人餐118元，4人餐238元，6人餐788元，10人餐1288元起;899代1000元;,周一至周日 11:00-14:00 17:00-21:00,0591-86303333,20089,,,False,0,164,20089,True,False
华莱士(小柳店),2658814,汉堡,华莱士,26189,http://p0.meituan.net/poi/40b78b9357bc226b82ad406d2d4ae43429705.png,4.6,18,3.8,黎明/小柳市场,95,26.075564,119.289768,鼓楼区柳河路1号13店面（小柳农贸市场对面）,,"5307,",,3.8元特价黑椒鸡块，7.8元小吃组，9.9元单人餐A，10元小食套餐，13.9元单人餐B，19.9元双人餐A，28.9元双人餐B;,周一至周日 08:00-22:00  2019-01-28至2019-02-15 休息,0591-22855509,20020,烤翅、蜜汁烤鸡、板烧汉堡蛮好吃的，价格也“比KFC和麦当劳便宜”。而且“分店很多”，“一般都能找到在公司附近的”。叫份外卖当工作餐，“换换口味不错”。,,False,1,22,20020,True,False
潮福城喜司唛烧腊饼店(秀山店),5126717,烧腊,潮福城,766216,http://p1.meituan.net/poi/8e4ee23b9782c208b7b3ccc281cab42d94527.png,4.3,10,8.8,五四北,96,26.133416,119.312679,晋安区秀山路新宿花园C区18号店面（益丰大药房旁边）,,"4283,4281,",,8.8代10元;,周一至周日 07:00-22:00,0591-87629585,19946,,,False,0,10,19946,True,False
韩阁炭火烤肉,4211177,韩式烤肉,,0,,4.1,75,95,左海/西湖公园,95,26.086557,119.294551,鼓楼区元帅路68-1号（三坊七巷斜对面）,,"4286,",,双人餐198元起，双人餐198元起，3人餐238元，4人餐288元;95代100元;,周一至周日 11:00-24:00,0591-83731777,19737,,,False,0,20,19737,True,False
华莱士(北尚店),41932543,汉堡,华莱士,26189,http://p0.meituan.net/poi/40b78b9357bc226b82ad406d2d4ae43429705.png,4.1,18,3.8,五四北,96,26.133631,119.312304,晋安区郭前路新宿花园14座2#3#店面,,"4283,",,3.8元特价黑椒鸡块，7.8元小吃组，9.9元单人餐A，10元小食套餐，13.9元单人餐B，19.9元双人餐A，28.9元双人餐B;,周一至周日 08:00-22:00,0591-83952660,19711,,,False,1,15,19711,True,False
华莱士(秀山店),2724334,汉堡,华莱士,26189,http://p0.meituan.net/poi/40b78b9357bc226b82ad406d2d4ae43429705.png,4.1,17,3.8,五四北,96,26.140565,119.324301,晋安区五四北路部队16号门面（永辉超市旁）,,"4285,4283,",,3.8元特价黑椒鸡块，7.8元小吃组，9.9元单人餐A，10元小食套餐，13.9元单人餐B，19.9元双人餐A，28.9元双人餐B;,周一至周日 09:00-00:00,0591-87959627,19648,,,False,1,74,19648,True,False
令狐冲·窑烤活鱼(连江店),41238035,烤鱼,令狐冲窑烤活鱼,1861897,http://p0.meituan.net/poi/4b195468026c96ab222cef00cb39a60637864.png,3.8,51,95,连江县中心城区,2956,26.210699,119.537801,连江县丹凤花园19-21号楼12-15号,,,,2-3人餐139元，3-4人餐188元;95代100元;,周一至周日 11:00-14:00 17:00-02:00,0591-26253777,19550,,,False,1,58,19550,False,False
高兴壹锅汕头鲜牛肉火锅,164841019,潮汕牛肉火锅,,0,,3.9,78,75,省立/旗汛口,95,26.086573,119.304306,鼓楼区东街92-2号（中福广场裙楼2楼，旗汛口公交站旁）,2,"4286,",,单人午餐75元，单人晚餐85元，双人餐99元，2-3人餐138元，4-6人餐258元，6-8人餐299元，单人晚餐390元，8-10人餐399元;85代100元;,周一至周日 11:00-24:00,0591-88282333,19398,,,False,0,240,19398,False,False
华莱士(洋下店),832442,汉堡,华莱士,26189,http://p0.meituan.net/poi/40b78b9357bc226b82ad406d2d4ae43429705.png,4,18,3.8,华林路/茶园,96,26.102233,119.316242,晋安区六一北路82号,,"4278,4284,",,3.8元特价黑椒鸡块，7.8元小吃组，9.9元单人餐A，10元小食套餐，13.9元单人餐B，19.9元双人餐A，28.9元双人餐B;,周一至周日 09:00-24:00,0591-87577920,19120,烤翅、蜜汁烤鸡、板烧汉堡蛮好吃的，价格也“比KFC和麦当劳便宜”。而且“分店很多”，“一般都能找到在公司附近的”。叫份外卖当工作餐，“换换口味不错”。,,False,1,24,19120,True,False
